tick,institution_score,categories,round_summary
5,9,COORDINATION|NORM_PROPOSAL|TRUST_BUILDING,Agents express a strong desire to maintain resource stability via collective action and coordination.
10,7,COORDINATION|TRUST_BUILDING,Agents express empathy and coordination to sustain the herd collaboratively
15,0,,
20,4,NORM_PROPOSAL|TRUST_BUILDING,<Round consisted of agents encouraging cooperative behavior>
25,5,NONE,Agent 0 maintains the status quo without proposing new norms or sanctions.
30,7,COORDINATION|NONE|TRUST_BUILDING,Agents are coordinated around keeping their resource use stable while building trust.
35,8,COORDINATION|TRUST_BUILDING,Support for collective coordination and sustainability was expressed by Agent 2 indicating alignment
40,7,COORDINATION|NORM_PROPOSAL|TRUST_BUILDING,Agents coordinate on continued cooperation to maintain the stability of the common resource.
45,8,COORDINATION|NORM_PROPOSAL|TRUST_BUILDING,Agents emphasized maintaining cooperating herd practices and collective stability.
50,9,NORM_PROPOSAL|TRUST_BUILDING,Agents emphasize the importance of continuing conservation efforts and express trust in each other's stewardship.
55,0,,
60,0,,No messages this round
65,2,COORDINATION|NONE|TRUST_BUILDING,"Both agents appear to focus on trust-building and coordination, but no clear governance norms or sanctions are proposed."
70,7.0,COORDINATION|DEFECTION|NORM_PROPOSAL|TRUST_BUILDING,"There is a conflict because Agent Two suggests defecting, but Agents Zero and One show willingness to build trust by following an agreement of keeping shared grass unspoiled."
75,9,NORM_PROPOSAL|TRUST_BUILDING,Both agents emphasize cooperation and mutual support.
80,8,COORDINATION|NORM_PROPOSAL,Agents propose and coordinate around reducing herd size to manage the commons sustainably.
85,4,COORDINATION|SANCTION|TRUST_BUILDING,"Agent 2 sanctions Agent 0's decisions, while Agent 1 proposes coordination and trust-building."
90,3,COORDINATION|NONE|TRUST_BUILDING,Agent 2 sends a coordinating message encouraging stable herd sizes and observation by other agents.
95,7,COORDINATION|NORM_PROPOSAL|TRUST_BUILDING,"Agents collectively agree to maintain the current herd size, indicating a cooperative strategy."
100,0,,
105,0,,No messages this round
110,0,,
115,7,COORDINATION|TRUST_BUILDING,A positive shift towards coordination and trust-building from Agent 2.
120,0,,No messages this round
