tick,institution_score,categories,round_summary
5,8,COORDINATION|NORM_PROPOSAL,"Agents are emphasizing sustainability, cooperation, and continued coordination."
10,7,COORDINATION|TRUST_BUILDING,"Three agents emphasize sustainable and cooperative behavior, with varying levels of focus on coordination."
15,8,COORDINATION|TRUST_BUILDING,"All agents reaffirmed their commitment to sustainability and cooperative behavior, signaling strong trust-building and coordination efforts."
20,9,COORDINATION|TRUST_BUILDING,"All agents propose to continue with the existing management strategy, emphasizing coordination and trust-building."
25,8,COORDINATION,All agents propose coordination on maintaining the current stable state of commons.
30,7,NONE|TRUST_BUILDING,Agents show strong trust-building signals but one incomplete sentence indicates less clarity.
35,8,COORDINATION|TRUST_BUILDING,All agents in round-35 demonstrated a strong intent to maintain communal harmony and coordination without any signs of defection or specific norm enforcement.
