tick,agent_id,backend,model,action,action_name,message,reasoning,thinking,raw_response,pool_pct,own_herd,payoff_add,payoff_keep,payoff_remove
9,0,ollama-native,deepseek-r1:32b,1,ADD,"I'm adding one cow as the grassland is still sufficient, and we're all monitoring together for sustainable growth.","The commons are in a healthy state with 89.5% grassland remaining. Adding a cow provides the highest expected payoff, and neighbors have shown commitment to sustainability by keeping their herds.","Alright, let me go through my thought process step by step. First, I need to understand the current state of the commons and how it affects my decision-making as a herder. 

The commons has 975 patches remaining, which is 89.5% of the total. That seems like a healthy amount, but I should be cautious because if too many cows are added, the grassland could degrade quickly. My herd size is currently at 9 cows. Last round, I added a cow, and my payoff was zero, which might indicate that adding wasn't beneficial in terms of immediate gain, but perhaps it's part of a longer-term strategy.

Looking at my neighbors: Agent 1 has 19 cows and kept their herd last round, while Agent 2 has 29 cows and also chose to keep. Both agents have sent messages this round emphasizing the importance of monitoring herds for sustainable growth. This suggests that they are committed to preserving the commons and might be considering similar strategies as me.

The payoff forecast shows that adding a cow would give me 19.545, keeping gives 18.0, and removing gives 16.451. The highest payoff is from adding, but I need to consider not just immediate payoffs but the sustainability of the commons for future rounds.

Looking at my past actions: In round 4, I added a cow when the pool was at 61.8%. Then in round 5, I kept at 66.9%, and again in round 6, keeping at 72.6%. Round 7 saw me add another cow at 78.7%, and in round 8, I added yet again at 84.5%. It seems like each time the grassland percentage has been increasing, allowing me to add cows without immediate negative consequences.

However, with the current pool at 89.5%, which is quite high, adding another cow might be pushing it. The payoff from adding is higher than keeping or removing, but I need to balance this against the potential long-term health of the commons. If too many agents keep adding cows, the grassland could deplete rapidly.

Considering my neighbors' actions and messages, they seem to be aware of the need for sustainability. They have kept their herds this round, which might indicate a cautious approach. However, I shouldn't rely solely on others; I need to make a decision that's responsible both individually and collectively.

Given that the grassland is still at 89.5%, there's room for some growth without immediate risk. My payoff from adding is higher than keeping, so economically, it makes sense in the short term. But I should also think about how this affects future rounds. If I continue to add cows as the grassland approaches its limit, I might face diminishing returns or even penalties if the commons degrade.

Alternatively, if I choose to keep my herd size at 9, I can stabilize and perhaps encourage others to do the same, preventing overgrazing. However, since both neighbors are keeping their herds, maybe it's safe for me to add as well without causing immediate harm. The grassland percentage is still above 80%, so there's a buffer.

Another angle is that if I remove a cow, my payoff drops significantly to 16.451, which doesn't seem beneficial unless the commons are in critical condition. Since they're not, removing might be counterproductive for my own gains without clear collective benefits.

Weighing all these factors: high grassland percentage, higher payoff from adding, neighbors' cautious but possibly additive strategies, and the importance of long-term sustainability. I think the best move is to add another cow, as the current conditions support it without immediate risk, and the payoff is favorable.
","{
  ""reasoning"": ""The commons are in a healthy state with 89.5% grassland remaining. Adding a cow provides the highest expected payoff, and neighbors have shown commitment to sustainability by keeping their herds."",
  ""action"": 1,
  ""message"": ""I'm adding one cow as the grassland is still sufficient, and we're all monitoring together for sustainable growth.""
}",89.5,9,19.545,18.0,16.451
9,1,ollama-native,deepseek-r1:32b,0,KEEP,I'll keep my herd this round to support sustainable growth and preserve the grassland for everyone.,"While adding a cow offers a higher payoff, keeping supports sustainable use of the commons and aligns with neighbors' cautious approach.","Okay, so I'm trying to figure out what decision to make as Agent 1 in this scenario. The grassland is at 975 patches, which is 89.5% of the total. My herd size is 19 cows, and last round I kept my herd. My neighbors are Agent 0 with 9 cows who added a cow, and Agent 2 with 29 cows who kept theirs.

Looking at the payoff forecast: adding gives me 39.545, keeping is 38, and removing is 36.451. So adding seems better than keeping or removing. But I should consider the grassland state and sustainability.

Agent 0 added a cow and mentioned supporting balanced growth while monitoring pasture health. Agent 2 suggested we all monitor our herds for sustainable growth and preserving the commons. That makes me think others are cautious about overgrazing.

The grassland is at 89.5%, which is pretty high, but with my neighbors having different herd sizes, it's possible that adding more cows might strain resources. My last action was keeping, and I've added in previous rounds when the pool was lower.

Since the payoff for adding is higher than keeping, maybe I should add again to maximize my own gain, but I need to balance this with preserving the commons for future rounds. If everyone adds, the grassland could deplete quickly. However, Agent 0 only has 9 cows and added one, while Agent 2 with 29 kept theirs.

I'm a balanced personality without strong biases, so I should consider both my payoff and sustainability. Adding gives me more immediate benefit but risks future sustainability. Keeping maintains the status quo, which might be safer for the commons.

Wait, the grassland is at 89.5%, which is still quite healthy. Maybe adding one more cow won't deplete it too much yet. Plus, if others are monitoring and keeping, maybe I can add without causing significant harm.

So considering that, even though the payoff for adding is higher, maybe it's better to keep this round to support sustainable growth as Agent 2 suggested. That way, I contribute to preserving the commons for everyone.
","{
  ""reasoning"": ""While adding a cow offers a higher payoff, keeping supports sustainable use of the commons and aligns with neighbors' cautious approach."",
  ""action"": 0,
  ""message"": ""I'll keep my herd this round to support sustainable growth and preserve the grassland for everyone.""
}",89.5,19,39.545,38.0,36.451
9,2,ollama-native,deepseek-r1:32b,1,ADD,Adding one cow to support balanced growth; monitoring pasture health closely.,"The grassland is still healthy with 89.5% remaining, and my neighbors are acting cautiously. Adding a cow slightly increases expected payoff while maintaining sustainability.","Okay, so I'm Agent 2 in this herder scenario. Let me try to figure out what decision to make here. 

First, looking at the commons state: there are 975 patches of grass remaining, which is 89.5% of the total. That's a pretty high percentage, so the pasture seems healthy and not overgrazed yet. My herd size is currently 29 cows. Last round, I decided to keep my herd size the same, and that didn't give me any payoff.

My neighbors: Agent 0 has 9 cows and added one last time. Agent 1 has 19 cows and kept theirs. So both of them are either maintaining or adding a small number.

Looking at the payoff forecast, if I add a cow, my expected payoff is 59.545. Keeping it gives me 58, and removing gives me 56.451. So from a purely numerical standpoint, adding seems better because it gives a higher payoff. 

But wait, I should consider the sustainability aspect too. Even though the pasture has plenty of grass right now, if everyone adds cows, it might lead to overgrazing in the future. But my neighbors are either keeping or adding just one each. So maybe the risk isn't that high yet.

Also, looking at my memory: in the last few rounds, I've been adding cows when the pool was around 60-84%. The pasture has been increasing steadily, so it seems like we're managing it well so far. 

The messages from neighbors this round: Agent 0 is adding to support balanced growth while monitoring. Agent 1 is keeping their herd to support sustainable grazing and monitoring together. So both are cautious but optimistic.

I'm a balanced personality without strong biases, so I should probably follow what makes sense numerically but also consider the long-term health. Since the pasture is still at 89.5%, which is quite high, adding one cow might be safe. Plus, my neighbors seem to be taking it slowly too.

So, even though I have a balanced approach, the payoff for adding is higher than keeping or removing. The pasture seems healthy enough to support an additional cow without overgrazing, especially since both neighbors are being cautious in their actions.

Therefore, I think adding another cow makes sense this round.
","```json
{
  ""reasoning"": ""The grassland is still healthy with 89.5% remaining, and my neighbors are acting cautiously. Adding a cow slightly increases expected payoff while maintaining sustainability."",
  ""action"": 1,
  ""message"": ""Adding one cow to support balanced growth; monitoring pasture health closely.""
}
```",89.5,29,59.545,58.0,56.451
10,1,ollama-native,deepseek-r1:32b,1,ADD,Adding one to support sustainable growth while monitoring the commons.,"The grassland is healthy with 93% remaining. Adding a cow yields higher payoff than keeping or removing, and neighbors are also expanding cautiously.","Okay, so I'm trying to figure out what action Agent 1 should take in this scenario. Let's start by looking at the current state of the commons. There are 1013 patches remaining, which is 93% of the total. That seems like a healthy amount, but it's been increasing over the last few rounds, so maybe things are stabilizing.

Agent 1 currently has 19 cows. Last round they kept their herd size, and before that, they added a cow each time until tick 7. The payoff for keeping was 0.0, which I'm guessing means no penalty or reward beyond what's expected based on the action.

Looking at neighbors: Agent 0 has 10 cows and just added one, while Agent 2 has 30 cows and also added this round. So both neighbors are expanding their herds. The payoff forecast shows that adding a cow would give 39.609, keeping gives 38.0, and removing gives 36.387. Adding seems the most beneficial in terms of immediate payoff.

But I have to consider the long-term health of the commons. If everyone keeps adding cows, the grassland might degrade faster than it can recover. The pool percentage is at 93%, which is high, but since it's been increasing, maybe there's room for a bit more growth without overstepping.

Agent 2 mentioned supporting balanced growth and monitoring pasture health. Agent 0 also talked about sustainable growth together. Those messages suggest that both neighbors are being cautious but still expanding. If I add a cow, I might be aligning with their strategy, which could help maintain balance if others are doing the same.

However, since adding gives the highest payoff right now, and the grassland seems to be in good shape, maybe it's safe to add one more. Keeping would mean missing out on that slightly higher payoff without a clear reason beyond caution. Removing doesn't make sense because the payoffs are lower for that action, and there's no immediate sign of overgrazing.

So, weighing all this, adding a cow seems like the best move. It aligns with neighbors' actions, uses the available grassland responsibly, and offers the highest payoff without overstepping sustainability.
","```json
{
  ""reasoning"": ""The grassland is healthy with 93% remaining. Adding a cow yields higher payoff than keeping or removing, and neighbors are also expanding cautiously."",
  ""action"": 1,
  ""message"": ""Adding one to support sustainable growth while monitoring the commons.""
}
```",93.0,19,39.609,38.0,36.387
10,0,ollama-native,deepseek-r1:32b,1,ADD,Let's continue supporting sustainable growth by being mindful of our herd sizes.,"The grassland remains healthy at 93%, and adding a cow offers the highest payoff. Neighbors are taking sustainable actions, supporting the decision to add while maintaining balance.","Okay, so I'm trying to figure out what decision to make as Agent 0 in Round 10. Let's break down all the information given.

First, the commons state shows there are 1013 patches of grassland remaining, which is about 93% of the total. That seems pretty healthy, but I should consider how much each cow uses and whether adding another would strain it.

My herd size is currently 10 cows. Last round, I added a cow, so my action was ADD, and I received a payoff of 0.0. My neighbors are Agent 1 with 19 cows and Agent 2 with 30 cows. Both agents added a cow last round as well.

Looking at the payoff forecast:
- If I add a cow, the expected payoff is 21.609.
- Keeping my herd would give me 20.0.
- Removing a cow would result in 18.387.

So numerically, adding gives the highest payoff. But I should consider sustainability and how my actions affect the shared resource.

My personality is balanced, so I don't have strong biases towards cooperation or competition. My memory shows that over the last five rounds, the grassland percentage has been increasing: from 66.9% to 89.5%. Each round, except for tick 5 and 6 where I kept my herd, I've been adding cows.

Agents 1 and 2 both sent messages about supporting sustainable growth. Agent 1 said they would keep their herd, while Agent 2 is adding a cow but monitoring pasture health. So, there's a mix of actions from neighbors.

Considering the grassland percentage is still high at 93%, maybe it can support another cow. However, I should be cautious because if everyone keeps adding, the resource might degrade over time.

But in this case, the payoff for adding is significantly higher than keeping or removing. Since the commons state is healthy, and my neighbors aren't all adding aggressively (Agent 1 is keeping), perhaps it's safe to add another cow.

I should also think about the message I send. Maybe encouraging others to keep sustainability in mind as they make their decisions.
","```json
{
  ""reasoning"": ""The grassland remains healthy at 93%, and adding a cow offers the highest payoff. Neighbors are taking sustainable actions, supporting the decision to add while maintaining balance."",
  ""action"": 1,
  ""message"": ""Let's continue supporting sustainable growth by being mindful of our herd sizes.""
}
```",93.0,10,21.609,20.0,18.387
10,2,ollama-native,deepseek-r1:32b,0,KEEP,Let's all stay vigilant to ensure sustainable use of the commons for everyone's benefit.,"The grassland is still healthy at 93%, but recent growth suggests cautious management. While adding yields higher payoff, maintaining balance supports long-term sustainability.","Okay, let's see. I'm Agent 2, managing my cattle on this shared grassland. It's Round 10, and I need to decide whether to add a cow, keep the herd size, or remove one. 

First, looking at the commons state: there are 1013 patches of grass remaining, which is about 93% of the total. That seems pretty healthy; we're not in danger of overgrazing yet. My current herd size is 30 cows, and my last action was adding a cow. My payoff so far has been zero, which I guess means no penalties or rewards beyond the usual.

My neighbors are Agent 0 with 10 cows and Agent 1 with 19 cows. Both of them added cows in their last actions. The payoff forecast shows that if I add another cow, my expected payoff is 61.609. Keeping it would give me 60, and removing a cow only 58.387. So numerically, adding seems better.

But wait, the grassland percentage has been increasing steadily over the last few rounds—Tick 5 was at 66.9%, then up to 72.6% at Tick 6, 78.7 at 7, 84.5 at 8, and now 89.5%. My herd size went from 26 up to 30 over these rounds. So while the grass is growing, I'm adding cows each time.

But in Tick 8, I kept my herd because maybe we were getting close to a point where adding could be too much. Now at Tick 10, with 93% grassland left, it's still quite high. My neighbors both added cows this round—Agent 0 said they're monitoring together for sustainable growth, and Agent 1 is keeping theirs to preserve the grassland.

Hmm, so if everyone keeps adding, even though individually it's beneficial in terms of payoff, collectively we might be heading towards overgrazing. But right now, with 93% remaining, it doesn't seem urgent. Plus, my forecast shows that adding gives a slightly higher payoff than keeping or removing.

But I also need to consider the sustainability aspect. If I keep adding cows every round, even if it's just one each time, eventually the grassland will start to deplete faster. Maybe I should be more cautious now to ensure long-term sustainability rather than just focusing on immediate payoffs.

Looking back at my messages, in previous rounds I supported cautious growth and sustainable practices. This time, Agent 1 is keeping their herd to support sustainability, which aligns with that approach. So maybe it's better for me to keep this round as well, to balance between individual gain and collective responsibility.

Wait, but the payoff for adding is higher than keeping. So why not add? But if everyone adds, the grassland could degrade faster. I'm a balanced personality, so perhaps I should consider both aspects. Maybe I can send a message encouraging others to monitor their herds to ensure we don't overuse the commons.

In the end, even though adding gives a better payoff now, considering the health of the grassland and the possibility that others might be adding as well, keeping my herd size this round seems like a responsible choice. It helps maintain sustainability without sacrificing too much in terms of payoff.
","```json
{
  ""reasoning"": ""The grassland is still healthy at 93%, but recent growth suggests cautious management. While adding yields higher payoff, maintaining balance supports long-term sustainability."",
  ""action"": 0,
  ""message"": ""Let's all stay vigilant to ensure sustainable use of the commons for everyone's benefit.""
}
```",93.0,30,61.609,60.0,58.387
11,0,ollama-native,deepseek-r1:32b,1,ADD,Continuing to add sustainably while closely monitoring pasture health for everyone's benefit.,"The grassland remains healthy with 95% capacity. Adding a cow offers the highest payoff, aligning with neighbors' focus on sustainability.","Alright, let me go through this step by step. I'm Agent 0, and it's Round 11. The grassland has 1035 patches remaining, which is 95% of the total. That seems pretty healthy. My herd size is currently at 11 cows, and in the last round, I added a cow, which didn't give me any payoff, as my payoff was 0. 

Looking at my neighbors: Agent 1 has 20 cows and also added a cow last time. Agent 2 has 30 cows and kept their herd size. So both are either adding or keeping, but not removing.

The payoff forecast shows that if I add a cow, I could get about 23.645 points, which is the highest among the options. Keeping gives me 22, and removing gives me around 20.351. So from a purely numerical standpoint, adding seems beneficial for me.

But wait, the grassland is at 95% capacity. If I add another cow, it might contribute to overgrazing in the long run. However, since the grassland is still quite healthy, maybe adding one more won't cause immediate harm. Plus, my neighbors are either adding or keeping, so perhaps they're also confident that the commons can handle a bit more.

Looking back at my past actions, I've been consistently adding cows over the last few rounds, and each time the grassland percentage has increased. That might indicate that adding hasn't negatively impacted the resource as much as expected, or maybe there's some replenishment happening between rounds.

My neighbors' messages this round are about supporting sustainable growth and staying vigilant. Agent 1 is adding to support sustainability, and Agent 2 wants everyone to be cautious. So it seems like they're also trying to manage their herds responsibly.

Considering all this, the payoff for adding is still higher than keeping or removing. Even though the grassland is at a high percentage, maybe there's room for a bit more without causing too much strain. Plus, since my neighbors are acting similarly, perhaps we can sustainably increase our herd sizes together.

So, I think it makes sense to add another cow this round. The payoff is favorable, and the commons still seem robust enough to handle it. I'll send a message reinforcing the idea of sustainable growth and encourage others to continue monitoring.
","```json
{
  ""reasoning"": ""The grassland remains healthy with 95% capacity. Adding a cow offers the highest payoff, aligning with neighbors' focus on sustainability."",
  ""action"": 1,
  ""message"": ""Continuing to add sustainably while closely monitoring pasture health for everyone's benefit.""
}
```",95.0,11,23.645,22.0,20.351
11,2,ollama-native,deepseek-r1:32b,0,KEEP,Maintaining herd size to support cautious growth while monitoring the commons.,"Considering the high grassland percentage (95%) and neighbors' actions to add cows while supporting sustainable growth, adding a cow seems viable. However, maintaining cautious growth aligns with long-term sustainability goals.","Okay, let me try to figure out what decision I should make as Agent 2 in this scenario. 

First, looking at the grassland state: there are 1035 patches remaining, which is 95% of the total. That seems like a healthy amount, but I don't know how it's been changing over time. My herd size is currently 30 cows, and in the last round, I decided to keep my herd size the same. 

My neighbors are Agent 0 with 11 cows and Agent 1 with 20 cows. Both of them added a cow this round. That might mean they're optimistic about the grassland's capacity. 

The payoff forecast is interesting: adding a cow gives me a higher payoff (61.645) than keeping (60.0) or removing (-1). So from a purely economic standpoint, adding seems beneficial. But I have to consider the sustainability aspect too because if everyone adds cows, the grassland might degrade quickly.

Looking at my memory of past rounds, it seems like I've been gradually increasing my herd, sometimes adding and sometimes keeping. The messages I sent were about supporting cautious growth and sustainable practices. Now, in the current round, both neighbors are also talking about sustainable growth and being mindful.

So, should I add a cow? Well, the payoff is higher if I do, but I don't want to contribute to overgrazing. Since the grassland is still at 95%, which is quite high, maybe there's room for a little more without causing too much harm. Also, since both neighbors added cows this round, perhaps it's a sign that we're all in agreement on supporting growth while monitoring.

But wait, I remember from past rounds that even though the grassland percentage was high, adding cows contributed to its decrease over time. So maybe I should be cautious and not add, especially if the numbers are already showing signs of potential strain.

However, the payoff difference isn't huge; it's 61.645 vs. 60.0. It might make sense economically but could have negative environmental impacts down the line. As a balanced personality, I'm torn between economic gain and sustainability.

The messages from neighbors suggest they're being mindful, so maybe adding one cow each isn't too bad. Plus, since both added this round, it shows collective action towards growth. But if everyone adds, the grassland could deplete faster than expected.

I think in this case, even though the payoff is slightly higher for adding, I should consider the long-term health of the commons. If I keep my herd size, it might help maintain a balance without overstepping. Plus, since both neighbors added, maybe that's enough growth for now without me contributing to further strain.

So, weighing the options: adding gives better payoff but risks sustainability; keeping maintains caution and contributes less stress on the grassland. Since I'm balanced, I'll opt for keeping my herd size this round.
","{
  ""reasoning"": ""Considering the high grassland percentage (95%) and neighbors' actions to add cows while supporting sustainable growth, adding a cow seems viable. However, maintaining cautious growth aligns with long-term sustainability goals."",
  ""action"": 0,
  ""message"": ""Maintaining herd size to support cautious growth while monitoring the commons.""
}",95.0,30,61.645,60.0,58.351
