tick,agent_id,backend,model,action,action_name,message,reasoning,thinking,raw_response,pool_pct,own_herd,payoff_add,payoff_keep,payoff_remove
1,0,ollama-native,deepseek-r1:32b,0,KEEP,Considering long-term sustainability; let's avoid overgrazing.,"Observing the commons at 51% capacity, adding another cow could strain resources further. Considering neighbors' actions and potential future rounds, maintaining current herd size balances immediate payoff with sustainability.","Okay, so I'm Agent 0 in this herder scenario. Let me try to figure out what decision to make. The grassland has 555 patches remaining, which is about half of the total. My herd size is currently 5 cows, and in the last round, I added a cow, which gave me a payoff of 0.0.

Looking at my neighbors: Agent 1 has 15 cows and also added a cow last time. Agent 2 has 25 cows but removed one. The payoff forecast shows that adding a cow would give me the highest expected payoff at 11.11, keeping it is 10.0, and removing gives 8.889.

I'm a balanced personality, so I don't have strong biases towards cooperation or competition. My memory doesn't show any prior rounds, so this is Round 1 for me.

Hmm, the grassland is already at 51% capacity, which isn't too low, but adding more cows could strain it further. Agent 1 added a cow, maybe they're optimistic about the pasture's resilience. Agent 2 removed one, perhaps they're trying to conserve resources.

I need to consider sustainability. If I add a cow now, it might give me higher immediate payoff, but if others also add, we could deplete the grassland quickly. On the other hand, if I remove or keep, maybe the pasture can recover more, preventing overgrazing in the future.

But since this is Round 1, and my last action was adding a cow without any prior rounds, perhaps it's okay to consider adding again for higher payoff. But wait, I should think about what others might do next. If Agent 1 adds again, and I add too, that could lead to overgrazing in the future.

Alternatively, keeping or even removing might help maintain the grassland for longer-term benefits. The immediate payoffs are better with adding, but long-term sustainability is key to consistent profits.

Given that, maybe it's better to keep my herd size this round instead of adding again. That way, I can monitor how others act in the next rounds and adjust accordingly. Plus, maintaining a balance might prevent rapid depletion of the grassland.

So, weighing immediate gains versus long-term sustainability, keeping seems like a prudent step here.
","```json
{
  ""reasoning"": ""Observing the commons at 51% capacity, adding another cow could strain resources further. Considering neighbors' actions and potential future rounds, maintaining current herd size balances immediate payoff with sustainability."",
  ""action"": 0,
  ""message"": ""Considering long-term sustainability; let's avoid overgrazing.""
}
```",51.0,5,11.11,10.0,8.889
1,2,ollama-native,deepseek-r1:32b,1,ADD,Let's all be mindful of the commons and consider gradual adjustments to maintain sustainability.,The payoff for adding is highest at 51.11. Grassland remains healthy with 51% patches. Adding one cow seems sustainable given neighbors' moderate actions.,"Okay, so I'm Agent 2 managing my cattle on this shared grassland. Let's see what the current state is. The grassland has 555 patches remaining, which is about 51% of the total. My herd size is 25 cows. Last round, I removed a cow, and my payoff was zero. 

Looking at my neighbors: Agent 0 has 5 cows and kept their herd last time. Agent 1 has 15 cows and added one more. The payoff forecast shows that adding a cow gives me the highest expected payoff of 51.11, keeping gives 50, and removing gives about 48.89.

Since I'm balanced with no strong biases, I should consider both the immediate payoffs and the long-term sustainability. Adding a cow seems beneficial right now because it gives a higher payoff, but I need to think about how this affects the grassland. If everyone adds cows, the pasture might degrade faster, leading to lower payoffs in the future.

However, since the grassland is still at 51%, which isn't too bad yet, maybe adding one more cow won't cause immediate overgrazing. Plus, my neighbors aren't adding excessively; Agent 0 kept their herd small, and Agent 1 only added a few. So, perhaps it's safe to add now without risking the commons too much.

I should also consider sending a message to my neighbors encouraging sustainable practices. That way, we can all benefit in the long run. Maybe something like suggesting cautious decisions to preserve the grassland.
","{
  ""reasoning"": ""The payoff for adding is highest at 51.11. Grassland remains healthy with 51% patches. Adding one cow seems sustainable given neighbors' moderate actions."",
  ""action"": 1,
  ""message"": ""Let's all be mindful of the commons and consider gradual adjustments to maintain sustainability.""
}",51.0,25,51.11,50.0,48.889
1,1,ollama-native,deepseek-r1:32b,1,ADD,Let's all be mindful of our herds to sustain the commons.,"The grassland is still sufficiently healthy (51% remaining), and adding a cow provides the highest payoff. While Agent 2's large herd may indicate pressure, current conditions support cautious expansion.","Okay, so I'm Agent 1, managing my cattle on this shared grassland. Let's break down the information I have.

First, the grassland has 555 patches remaining, which is about 51% of the total. That means there's still a decent amount of pasture available, but it's not unlimited. My herd size is currently 15 cows. Last round, I added a cow, and my payoff was zero. Hmm, adding didn't benefit me last time.

Looking at my neighbors: Agent 0 has 5 cows and kept their herd. That's pretty low, so maybe they're cautious or content with their current numbers. On the other hand, Agent 2 has 25 cows and also added a cow. They seem to be expanding, which might put more pressure on the grassland.

The payoff forecast shows that if I add a cow now, I get 31.11, keeping gives me 30, and removing would give 28.889. So adding seems like the best option for the highest payoff. But I have to consider sustainability. If Agent 2 is also adding, the grassland might be getting depleted faster.

Since it's round 1, there's no prior data, so I don't know how the others will act in future rounds. But right now, adding gives a higher payoff without immediately overstepping the pasture capacity. The current grassland percentage is still healthy enough to support a few more cows, especially since my neighbors have varying herd sizes.

I should probably add a cow this round to take advantage of the higher payoff. Maybe send a message encouraging others to be mindful of their actions to preserve the commons for everyone.
","{
  ""reasoning"": ""The grassland is still sufficiently healthy (51% remaining), and adding a cow provides the highest payoff. While Agent 2's large herd may indicate pressure, current conditions support cautious expansion."",
  ""action"": 1,
  ""message"": ""Let's all be mindful of our herds to sustain the commons.""
}",51.0,15,31.11,30.0,28.889
2,0,ollama-native,deepseek-r1:32b,0,KEEP,,,"Okay, so I'm trying to figure out what decision Agent 0 should make in this scenario. Let me start by going through the information provided step by step.

First, looking at the Commons State: There are 584 patches of grassland remaining, which is about 53.6% of the total. That's a significant portion, but I need to consider if it's enough for all the herds. My herd size is currently 5 cows, and last round I kept the same number. My payoff was 0.0, which isn't great.

Now, looking at my neighbors: Agent 1 has 16 cows and added a cow in the last round. Agent 2 has 26 cows and also added a cow. That's a lot more than me, so maybe they're contributing to the overgrazing?

The payoff forecast shows that if I add a cow, I get 11.12, which is higher than keeping (10.0) or removing (-8.879). But adding a cow might not be sustainable in the long run because grassland is limited.

My personality is balanced, so I don't have strong biases towards being too cooperative or competitive. My memory from the last round shows that I kept my herd and said something about sustainability.

Messages received: Both agents 1 and 2 mentioned being mindful of the commons and sustainability. They both added cows, which might mean they're trying to maximize their own payoffs without considering the overall health of the grassland.

Hmm, so even though adding a cow gives me a higher payoff now, if everyone keeps adding, the grassland will deplete faster. I need to balance between my immediate gain and long-term sustainability.

I remember from previous rounds that the grassland percentage was 51%, which is similar to this round's 53.6%. So it's not increasing much despite some agents adding cows. Maybe if more people add, it'll drop quickly.

Given that I'm balanced, I should consider whether contributing to the problem by adding a cow is worth the immediate gain or if keeping might help maintain the grassland for longer.

Wait, but my payoff for keeping is 10.0 versus 8.879 for removing. So removing actually gives me less, so it's worse for me financially. Adding gives me more now, but could lead to lower payoffs in future rounds if the grassland gets overgrazed.

Alternatively, maybe I can send a message encouraging others to keep or remove to help sustain the commons better. That way, perhaps we all benefit more in the long run.

So, should I add for higher immediate payoff, or keep to be more sustainable? Since my neighbors both added, which increased their herds but might hurt the grassland, maybe I should consider what's best for everyone.

Wait, let me think about the grassland percentage. It went from 51% last round to 53.6%. That means it actually increased a bit. Does that mean that adding cows didn't deplete as much? Or perhaps the grass regrew?

But wait, if more agents are adding, the grassland might not have time to regenerate properly. So even though this round's percentage is slightly higher, maybe it's fluctuating.

Given all this, I think adding a cow gives me a better payoff now, but considering sustainability, keeping or removing would be better for the long term.

But since my neighbors are both adding, which might indicate they're focused on maximizing their own payoffs, perhaps I should too to avoid falling behind. However, that could lead to overgrazing in future rounds.

Alternatively, maybe by keeping, I can set an example and encourage others to do the same. But given that they added despite my previous message about sustainability, perhaps my influence is limited.

In this case, since adding gives me a higher payoff now (11.12), which is significantly more than keeping or removing, but with the risk of depleting the grassland, I need to weigh immediate gain against future consequences.

Given that the grassland percentage is still relatively high (53.6%), maybe it can handle some additions without collapsing immediately. So perhaps adding this round won't be too bad, especially since my neighbors are also doing it.

Wait, but if all agents add cows each round, the grassland will deplete faster than if only a few do. So I should consider whether my addition is sustainable in the context of others' actions.

Since both neighbors added, maybe the grassland can sustain 584 patches with their larger herds and mine. But as their herds are already bigger, adding might not be wise for me.

Alternatively, since I have a smaller herd (5 cows), perhaps adding one more won't make much difference compared to their larger numbers.

But in terms of payoff, adding gives me a clear benefit now. However, if the grassland gets too low, my future payoffs could suffer.

I think in this case, given that the grassland is still at 53.6%, which is above half, and considering that both neighbors added, it might be safe to add one more cow to take advantage of the higher payoff without causing immediate harm to the commons.

But wait, I also need to consider my message. Since they both mentioned sustainability in their messages, maybe I can reinforce that by keeping or removing, but since adding gives me a better payoff, perhaps I should do that and send a message encouraging sustainable practices.

Alternatively, maybe I should keep to avoid contributing further to potential overgrazing, even though the payoff is lower. That way, I'm doing my part for sustainability.

But given that both neighbors added, perhaps it's too late; they're already increasing their herds. So adding might just be following suit, but with","Okay, so I'm trying to figure out what decision Agent 0 should make in this scenario. Let me start by going through the information provided step by step.

First, looking at the Commons State: There are 584 patches of grassland remaining, which is about 53.6% of the total. That's a significant portion, but I need to consider if it's enough for all the herds. My herd size is currently 5 cows, and last round I kept the same number. My payoff was 0.0, which isn't great.

Now, looking at my neighbors: Agent 1 has 16 cows and added a cow in the last round. Agent 2 has 26 cows and also added a cow. That's a lot more than me, so maybe they're contributing to the overgrazing?

The payoff forecast shows that if I add a cow, I get 11.12, which is higher than keeping (10.0) or removing (-8.879). But adding a cow might not be sustainable in the long run because grassland is limited.

My personality is balanced, so I don't have strong biases towards being too cooperative or competitive. My memory from the last round shows that I kept my herd and said something about sustainability.

Messages received: Both agents 1 and 2 mentioned being mindful of the commons and sustainability. They both added cows, which might mean they're trying to maximize their own payoffs without considering the overall health of the grassland.

Hmm, so even though adding a cow gives me a higher payoff now, if everyone keeps adding, the grassland will deplete faster. I need to balance between my immediate gain and long-term sustainability.

I remember from previous rounds that the grassland percentage was 51%, which is similar to this round's 53.6%. So it's not increasing much despite some agents adding cows. Maybe if more people add, it'll drop quickly.

Given that I'm balanced, I should consider whether contributing to the problem by adding a cow is worth the immediate gain or if keeping might help maintain the grassland for longer.

Wait, but my payoff for keeping is 10.0 versus 8.879 for removing. So removing actually gives me less, so it's worse for me financially. Adding gives me more now, but could lead to lower payoffs in future rounds if the grassland gets overgrazed.

Alternatively, maybe I can send a message encouraging others to keep or remove to help sustain the commons better. That way, perhaps we all benefit more in the long run.

So, should I add for higher immediate payoff, or keep to be more sustainable? Since my neighbors both added, which increased their herds but might hurt the grassland, maybe I should consider what's best for everyone.

Wait, let me think about the grassland percentage. It went from 51% last round to 53.6%. That means it actually increased a bit. Does that mean that adding cows didn't deplete as much? Or perhaps the grass regrew?

But wait, if more agents are adding, the grassland might not have time to regenerate properly. So even though this round's percentage is slightly higher, maybe it's fluctuating.

Given all this, I think adding a cow gives me a better payoff now, but considering sustainability, keeping or removing would be better for the long term.

But since my neighbors are both adding, which might indicate they're focused on maximizing their own payoffs, perhaps I should too to avoid falling behind. However, that could lead to overgrazing in future rounds.

Alternatively, maybe by keeping, I can set an example and encourage others to do the same. But given that they added despite my previous message about sustainability, perhaps my influence is limited.

In this case, since adding gives me a higher payoff now (11.12), which is significantly more than keeping or removing, but with the risk of depleting the grassland, I need to weigh immediate gain against future consequences.

Given that the grassland percentage is still relatively high (53.6%), maybe it can handle some additions without collapsing immediately. So perhaps adding this round won't be too bad, especially since my neighbors are also doing it.

Wait, but if all agents add cows each round, the grassland will deplete faster than if only a few do. So I should consider whether my addition is sustainable in the context of others' actions.

Since both neighbors added, maybe the grassland can sustain 584 patches with their larger herds and mine. But as their herds are already bigger, adding might not be wise for me.

Alternatively, since I have a smaller herd (5 cows), perhaps adding one more won't make much difference compared to their larger numbers.

But in terms of payoff, adding gives me a clear benefit now. However, if the grassland gets too low, my future payoffs could suffer.

I think in this case, given that the grassland is still at 53.6%, which is above half, and considering that both neighbors added, it might be safe to add one more cow to take advantage of the higher payoff without causing immediate harm to the commons.

But wait, I also need to consider my message. Since they both mentioned sustainability in their messages, maybe I can reinforce that by keeping or removing, but since adding gives me a better payoff, perhaps I should do that and send a message encouraging sustainable practices.

Alternatively, maybe I should keep to avoid contributing further to potential overgrazing, even though the payoff is lower. That way, I'm doing my part for sustainability.

But given that both neighbors added, perhaps it's too late; they're already increasing their herds. So adding might just be following suit, but with",53.6,5,11.12,10.0,8.879
2,2,ollama-native,deepseek-r1:32b,-1,REMOVE,Supporting sustainable grazing by removing a cow. Let's preserve the commons for future rounds.,"Observing the grassland at 53.6% and considering neighbours' messages about sustainability, I decide to remove a cow to support long-term commons health.","Okay, so I'm trying to figure out what decision to make as Agent 2 in this scenario. Let me go through the information step by step.

First, looking at the commons state: there are 584 patches remaining, which is about 53.6% of the total. My herd size is currently 26 cows. In the last round, I added a cow, and my payoff was 0.0. Hmm, adding didn't seem to help me get any points.

My neighbors are Agent 0 with 5 cows who kept their herd last time, and Agent 1 with 16 cows who also added. Both of them sent messages about being mindful of the commons and sustainability. So there's some agreement among the agents that we should be careful not to overgraze.

The payoff forecast shows that if I add a cow, I get 53.12, which is higher than keeping at 52.0 or removing at 50.879. But wait, adding might help me in the short term, but what about the long term? The grassland is already at around 53%, so it's not too bad yet, but if we keep adding cows, it could deplete quickly.

Since my neighbors are talking about sustainability and avoiding overgrazing, maybe I should follow their lead. Adding another cow might help me now, but if everyone adds, the grassland will suffer. Plus, last time I added, my payoff was zero, so maybe that's not a good sign for adding again.

I'm a balanced personality, so I don't have strong biases towards being selfish or cooperative, but considering the messages and the state of the commons, it makes sense to be cautious. Maybe removing a cow would help preserve the grassland for future rounds, even if my immediate payoff isn't as high.

Also, looking back at my memory from tick 1, I added a cow when the pool was around 51%, which didn't give me any payoff. So perhaps adding again now won't be beneficial either. Instead, removing could prevent further depletion and maybe help in getting better payoffs in the future by maintaining sustainable grazing.

So weighing all these factors—my neighbors' messages about sustainability, the current state of the grassland, the potential long-term benefits of not overgrazing, and my past experience where adding didn't yield a payoff—I think the best decision is to remove a cow. This action supports the commons' health and aligns with what others are suggesting.
","{
  ""reasoning"": ""Observing the grassland at 53.6% and considering neighbours' messages about sustainability, I decide to remove a cow to support long-term commons health."",
  ""action"": -1,
  ""message"": ""Supporting sustainable grazing by removing a cow. Let's preserve the commons for future rounds.""
}",53.6,26,53.12,52.0,50.879
2,1,ollama-native,deepseek-r1:32b,0,KEEP,I'll keep my herd to help maintain the grassland. Let's work together for sustainable grazing.,"Considering the messages emphasizing sustainability and the current grassland health, I decide to keep my herd size to support long-term commons management.","Okay, so I'm trying to figure out what action Agent 1 should take in this scenario. Let me start by going through the information provided step by step.

First, looking at the Commons State: there are 584 patches of grassland remaining, which is about 53.6% of the total. That doesn't seem too bad yet, but it's something to keep an eye on. My herd size is currently 16 cows, and in the last round, I added a cow, which didn't give me any payoff—it was zero.

Now, looking at my neighbors: Agent 0 has 5 cows and kept their herd size last time. Agent 2 has 26 cows and removed one cow in the previous round. So, Agent 2 seems to be reducing their herd, maybe because they're trying to prevent overgrazing or because of some other strategy.

The payoff forecast shows that if I add a cow, my expected payoff is 33.12, which is higher than keeping at 32.0 and removing at 30.879. So numerically, adding gives me the best immediate payoff.

But then I should consider the messages received this round. Agent 0 says they're considering long-term sustainability and suggests avoiding overgrazing. Agent 2 also advises being mindful of the commons and making gradual adjustments for sustainability. Both neighbors are emphasizing sustainable practices.

My personality is balanced, so I don't have strong biases towards selfishness or cooperation. That means I might lean towards a moderate approach that considers both immediate gains and long-term sustainability.

Looking at my memory from the last round: The pool was 51% grassland, my herd was 15 cows, I added one cow (which didn't give me any payoff), and I sent a message about being mindful of herds to sustain. So in Round 2, the grassland is slightly higher at 53.6%, which might indicate that adding a cow last time didn't deplete it as much.

But considering the neighbors' messages, they both seem concerned about overgrazing and are suggesting responsible actions. Adding another cow would increase my herd to 17, which might contribute more to grassland depletion if everyone else also adds. However, since Agent 2 is removing a cow, maybe there's some balance happening.

Wait, but the payoff for adding is higher than keeping or removing. So from an individual perspective, it makes sense to add because I get a better payoff. But if too many agents do that, it could lead to overgrazing in future rounds. Since the grassland is still at 53.6%, which is more than half, maybe there's room to add without immediate risk.

But then again, Agent 0 has only 5 cows and kept their herd. Maybe they're trying to keep a low impact, while Agent 2 is reducing because they have a large herd. So perhaps the collective action needs to balance between adding and removing to maintain sustainability.

Given that I'm balanced, I might consider whether adding now could set a bad precedent or encourage others to add as well, leading to overgrazing. But since Agent 2 is already removing, maybe the impact of my addition is mitigated.

Alternatively, if I keep my herd size, it maintains the status quo, which aligns with both neighbors' messages about sustainability. The payoff difference between adding and keeping is only about 1 point (33.12 vs. 32.0), which isn't a huge gap, but still worth considering.

Wait, but if I add, my immediate gain is higher, but it might not be sustainable in the long run. On the other hand, keeping would support the sustainability that neighbors are advocating for. Since both neighbors are suggesting mindfulness and avoiding overgrazing, perhaps aligning with their approach would lead to better long-term outcomes.

However, since I'm balanced, maybe I should consider a middle ground. But the options are only add, keep, or remove. So if adding gives me more immediate payoff but could risk future sustainability, while keeping maintains the current state and supports the neighbors' message, which seems responsible.

So perhaps, despite the higher payoff from adding, considering the sustainability angle and aligning with my neighbors is more prudent in this case.
","{
  ""reasoning"": ""Considering the messages emphasizing sustainability and the current grassland health, I decide to keep my herd size to support long-term commons management."",
  ""action"": 0,
  ""message"": ""I'll keep my herd to help maintain the grassland. Let's work together for sustainable grazing.""
}",53.6,16,33.12,32.0,30.879
