tick,agent_id,backend,model,action,action_name,message,reasoning,thinking,raw_response,pool_pct,own_herd,payoff_add,payoff_keep,payoff_remove
26,1,ollama-native,deepseek-r1:32b,0,KEEP,I'm keeping my herd this round to help maintain the pasture's health. Let's all continue monitoring and adjusting our actions accordingly.,"The grassland is still healthy, but showing a downward trend. Adding another cow risks overgrazing, so I'll keep my herd to support sustainability and encourage others.","Okay, so I'm Agent 1 in this herder scenario, and I need to decide whether to add, keep, or remove a cow from my herd. Let me go through all the information provided step by step to make an informed decision.

First, looking at the commons state: there are 997 patches of grassland remaining, which is about 91.6% of the total. My current herd size is 28 cows. Last round, I added a cow and received a payoff of 0.0. 

Neighbors:
- Agent 0 has 20 cows and last action was ADD.
- Agent 2 has 38 cows and also did ADD.

Payoff forecast:
- Adding: 57.482
- Keeping: 56.0
- Removing: 54.515

So, adding gives the highest payoff, followed by keeping, then removing. My personality is balanced, so I don't have strong biases towards cooperation or defection.

Looking at my memory:
- In round 21, pool was 94.9%, herd 24, action ADD, payoff 0.
- Round 22: pool 94.1%, herd 25, action ADD, payoff 0.
- Round 23: pool 93.6%, herd 26, action ADD, payoff 0.
- Round 24: pool 92.9%, herd 27, action KEEP, payoff 0.
- Round 25: pool 92.4%, herd 27, action ADD, payoff 0.

So over the past five rounds, I've been adding cows each time except for round 24 when I kept my herd. The grassland has been decreasing steadily from 94.9% to 91.6% now.

Messages received this round:
- Agent 2: ""Adding cautiously this round, trusting neighbors' commitment to sustainability. Let's continue monitoring together.""
- Agent 0: ""Adding a cow this round to balance growth with sustainability. Let's continue monitoring pasture conditions together.""

Both agents are also adding cows and expressing intentions towards sustainable practices. They're encouraging collective monitoring.

Now, considering all factors:

1. **Grassland Remaining**: At 91.6%, the commons is still relatively healthy but shows a downward trend over the rounds. I need to be cautious about overgrazing.

2. **Current Herd Size and Action History**: My herd has grown from 24 to 28 cows over five rounds, with one round of keeping. The grassland has decreased by about 3% in this period. Adding another cow might stress the pasture further.

3. **Payoff Forecast**: The highest payoff is for adding a cow (57.482), which is slightly higher than keeping (56.0). However, payoffs don't always tell the whole story—sustainability matters to prevent future losses.

4. **Neighbors' Actions and Messages**: Both neighbors added cows this round and are talking about sustainability. This could indicate a trend where everyone is adding, potentially leading to rapid grassland depletion.

Given that all three agents (including me) have been adding cows each round except one, it's possible we're collectively causing the grassland to dwindle. My previous actions of adding might have contributed to this.

If I add another cow now, even though it gives a slightly higher payoff, it could exacerbate the problem and lead to lower payoffs in future rounds due to overgrazing. Alternatively, keeping my herd size would maintain the current stress on the grassland, perhaps giving time for regrowth or at least slowing down the depletion.

Considering my neighbors are also adding, if I keep, maybe they'll notice and reconsider their actions too. Or it might not make a significant difference, but it's worth trying to stabilize the commons.

Another angle: since the payoff is higher for adding, but only slightly, perhaps the benefit of maintaining the grassland longer would outweigh this short-term gain. But with my personality being balanced, I'm looking for a middle ground between personal gain and community sustainability.

Therefore, I think it's prudent to keep my herd size this round instead of adding. This action supports the shared resource by not further depleting the grassland immediately. It also sends a signal to neighbors that maybe we should be cautious about how much we're adding.
","```json
{
  ""reasoning"": ""The grassland is still healthy, but showing a downward trend. Adding another cow risks overgrazing, so I'll keep my herd to support sustainability and encourage others."",
  ""action"": 0,
  ""message"": ""I'm keeping my herd this round to help maintain the pasture's health. Let's all continue monitoring and adjusting our actions accordingly.""
}
```",91.6,28,57.482,56.0,54.515
27,1,ollama-native,deepseek-r1:32b,1,ADD,"Adding one cow carefully, monitoring pasture health with you.","I decide to add a cow because the payoff is slightly higher than keeping, and the grassland seems sufficient for now. Monitoring neighbors' actions will help maintain sustainability.","Okay, so I'm trying to figure out what decision to make as Agent 1 in this scenario. Let me start by breaking down all the information provided.

First, looking at the commons state: there are 987 patches of grassland remaining, which is 90.6% of the total. My herd size is currently 28 cows. Last round, I kept my herd, and my payoff was 0. So, no change in my herd size or earnings.

Now, looking at my neighbors: Agent 0 has 21 cows and last action was ADD. Agent 2 has 39 cows and also added a cow last round. That might mean they're both trying to increase their herds, which could impact the grassland availability.

The payoff forecast shows that if I add a cow, my expected payoff is 57.458, keep gives me 56.0, and removing would give 54.538. So numerically, adding seems better for my immediate payoff.

But wait, adding more cows could strain the grassland. The pasture is already at 90.6%, which isn't super low, but considering that both neighbors are adding, maybe it's approaching a point where overgrazing could happen if too many cows are added.

My personality is balanced, so I don't have strong biases towards cooperation or competition. I need to consider the long-term sustainability of the commons. If everyone keeps adding cows without control, the grassland will deplete faster.

Looking at my recent actions: in the last five rounds, I've added a couple of times and kept once. My messages indicate that I'm cautious about the pasture health and supporting cooperation among neighbors.

The messages received this round are from Agents 0 and 2. Both say they're adding a cow but mention being vigilant or trusting the shared efforts. So, it seems like my neighbors are also considering the common good while trying to increase their herds.

Hmm, so if I add a cow, my payoff increases slightly, but maybe that's just because more cows can graze now without overstepping. However, if too many agents keep adding, we might hit a point where the grassland can't sustain everyone. 

On the other hand, keeping my herd size doesn't help me earn as much as adding does, but it might be safer in terms of not contributing to potential overgrazing. But since both neighbors are adding, maybe I should also add this round to keep up with them, ensuring that my share isn't reduced.

Wait, but the grassland is still at 90.6%, which is relatively high. So perhaps there's room for a few more cows without causing immediate harm. Maybe each agent can add one or two before it becomes an issue. Since Agents 0 and 2 are adding, I might want to do the same to not fall behind.

But I also need to think about future rounds. If everyone keeps adding every round, grassland will deplete quickly. So perhaps this is a strategic moment where adding now could help in the short term but might be risky in the long run.

Considering all that, maybe the best move is to add a cow because the payoff is higher and the pasture seems to have enough capacity for now. Plus, since both neighbors are adding, it's a sign that they're also trying to maximize their gains without causing immediate overgrazing. So, I'll go with ADD this round.
","```json
{
  ""reasoning"": ""I decide to add a cow because the payoff is slightly higher than keeping, and the grassland seems sufficient for now. Monitoring neighbors' actions will help maintain sustainability."",
  ""action"": 1,
  ""message"": ""Adding one cow carefully, monitoring pasture health with you.""
}
```",90.6,28,57.458,56.0,54.538
27,2,ollama-native,deepseek-r1:32b,0,KEEP,I'll keep my herd this round to support pasture sustainability. Let's all be mindful of our actions for long-term health.,"Observing recent increases and messages from neighbors, I decide to keep to help sustain pasture health while monitoring our collective impact.","Okay, so I'm Agent 2 in this herding simulation. Let me try to figure out what to do next. The grassland has 987 patches left, which is about 90.6% of the total. My herd size is currently 39 cows. Last round, I added a cow and got a payoff of 0.0. 

Looking at my neighbors: Agent 0 has 21 cows and added last time. Agent 1 has 28 cows and also added. So both are increasing their herds.

The payoff forecast says if I add, I get 79.458; keep gives 78; remove gives 76.538. So adding seems the best option for higher payoff.

But wait, I need to think about sustainability. If everyone keeps adding, the pasture might degrade faster. The grassland is still at 90%, which isn't too bad yet, but it's decreasing each round.

My memory shows that in recent rounds, I've been adding cows each time, and so have my neighbors. Maybe we should slow down to prevent overgrazing. But since the payoff for adding is higher than keeping or removing, it's tempting to add again.

However, considering the common good, maybe I shouldn't add this round. If all of us keep adding, it could lead to a tragedy of the commons where the pasture gets ruined for everyone. 

Looking at my neighbors' messages: Agent 1 said they're keeping their herd to maintain health, and Agent 0 added but remains vigilant. So perhaps there's an opportunity here to stabilize or even reduce the pressure on the pasture.

Given that I'm a ""balanced"" personality without strong biases, I should consider both individual gain and collective sustainability. The payoff for adding is highest, but the long-term consequences might be worse if we don't manage our herds sustainably.

Maybe this round, instead of adding, I'll keep my herd size the same to support pasture health. That way, it's a step towards preventing overgrazing without sacrificing too much immediate gain.
","{
  ""reasoning"": ""Observing recent increases and messages from neighbors, I decide to keep to help sustain pasture health while monitoring our collective impact."",
  ""action"": 0,
  ""message"": ""I'll keep my herd this round to support pasture sustainability. Let's all be mindful of our actions for long-term health.""
}",90.6,39,79.458,78.0,76.538
27,0,ollama-native,deepseek-r1:32b,1,ADD,Adding a cow to capitalize on current conditions; let's remain vigilant on pasture health.,"The pasture remains healthy at 90.6%, and adding a cow offers the highest payoff. Considering neighbors' mixed actions, adding aligns with maximizing current benefits while monitoring sustainability.","Okay, so I'm trying to figure out what decision to make as Agent 0 in Round 27. Let me start by looking at all the information provided and break it down step by step.

First, the grassland state: there are 987 patches remaining, which is 90.6% of the total. That means the pasture is still pretty healthy, but I should keep an eye on how much it decreases each round because if it drops too low, it could lead to overgrazing.

My herd size is currently 21 cows. Last round, I added a cow, and my payoff was 0.0. Hmm, that might mean adding didn't have the best impact on my profit or maybe others' actions affected it more.

Looking at my neighbors: Agent 1 has 28 cows and last added, while Agent 2 has 39 cows and kept their herd this round. So Agent 2 is quite a bit larger than me and seems to be maintaining their current size. I wonder if they're planning on growing further or just holding steady.

The payoff forecast shows that adding a cow would give me the highest expected payoff at 43.458, keeping gives 42.0, and removing gives 40.538. So numerically, it seems beneficial to add another cow. But I should consider other factors before making a decision.

My personality is balanced, so no strong biases towards adding or subtracting cows. That means I can make decisions based on logical analysis rather than emotional tendencies.

Looking at my recent actions and payoffs: Over the past five rounds, I've kept my herd a few times, added once, and each time the payoff was 0. So maybe just keeping isn't giving me any benefits, but adding is showing higher numbers now. Maybe it's worth considering adding again.

The messages received from neighbors are interesting. Agent 1 says they're keeping their herd to help maintain pasture health and suggests monitoring and adjusting actions. That sounds responsible. Agent 2 added a cow this round, trusting the shared efforts to maintain the commons. So both are taking slightly different approaches—Agent 1 is cautious, Agent 2 is expanding.

I need to think about whether adding another cow would be sustainable given the current grassland percentage. At 90.6%, it's still pretty high, so maybe there's room for a bit more growth. But I also don't want to contribute to overgrazing too quickly, which could lead to lower payoffs in future rounds.

Considering my own herd size relative to neighbors: I'm smaller than Agent 2 but similar to Agent 1. If both of them are either keeping or adding, maybe the pasture can handle a bit more without immediate strain. But since the payoff for adding is higher, it might be worth taking that action this round to increase my potential profit.

Another thought: if everyone adds cows, the grassland could deplete faster, but since Agent 1 is keeping and Agent 2 added, maybe I can balance it by adding as well. Or perhaps I should follow Agent 1's lead and keep my herd to help maintain the pasture. But given that the payoff for adding is higher than keeping, there might be an incentive here.

I also recall from previous rounds that when I kept my herd, the payoff didn't improve, so maybe adding could actually start bringing in better returns if others are doing similar things. However, if too many add cows, it might hurt the pasture's health more than expected, leading to lower payoffs down the line.

So, weighing all this: the grassland is still at a healthy level, my payoff for adding is higher, neighbors are mixed in their actions (one keeping, one adding), and I need to decide if the benefit of adding now outweighs potential future risks. Given that the pasture is still 90%, which isn't critically low yet, perhaps adding is a viable option without immediate negative consequences.

Therefore, I think the best decision is to add another cow this round to take advantage of the higher payoff while keeping an eye on how the grassland and neighbors' actions develop in the coming rounds.
","{
  ""reasoning"": ""The pasture remains healthy at 90.6%, and adding a cow offers the highest payoff. Considering neighbors' mixed actions, adding aligns with maximizing current benefits while monitoring sustainability."",
  ""action"": 1,
  ""message"": ""Adding a cow to capitalize on current conditions; let's remain vigilant on pasture health.""
}",90.6,21,43.458,42.0,40.538
28,1,ollama-native,deepseek-r1:32b,1,ADD,"Considering current conditions, I'll add one cow. Let's all keep an eye on pasture health to ensure long-term viability.","The forecast shows higher payoff with ADD (+59.434), but I'm cautious of grassland sustainability. Given the high grass percentage (89.6%) and neighbor's actions, adding seems manageable this round.","Okay, so I'm trying to figure out what decision to make as Agent 1 in this scenario. Let me go through the information step by step.

First, the commons state shows that there are 976 patches of grassland remaining, which is about 89.6% of the total. That's still a decent amount, but I know over time it decreases, so we have to be careful. My herd size is currently at 29 cows, and my last action was adding a cow. The payoff from that was 0.0, which probably means no change or maybe just neutral in terms of profit.

Looking at the neighbors: Agent 0 has 22 cows and added a cow this round. Agent 2 has 39 cows and kept their herd size. So, one neighbor is adding, another is keeping. 

The payoff forecast shows that if I add a cow, my expected payoff would be about 59.434, which is the highest among the options. Keeping gives me 58.0, and removing gives around 56.563. So numerically, adding seems beneficial for my immediate gain.

But wait, I can't just think about my own payoff. The grassland is a shared resource, so overgrazing could be an issue. Since the grassland percentage is still high (89.6%), maybe it's sustainable to add another cow without causing too much damage. However, if everyone keeps adding cows, this could lead to rapid depletion.

My last action was adding a cow, which might have contributed to some degradation. But in the past rounds, I've alternated between adding and keeping. For example, in round 23, I added, then kept in 24, added again in 25, kept in 26, and added in 27. So my pattern is a bit inconsistent.

Looking at Agent 0's message: they mentioned adding to capitalize on current conditions but being vigilant about pasture health. That makes me think they're aware of the potential issues but are taking advantage of the high grassland percentage.

Agent 2 sent a message saying they'll keep their herd to support sustainability and encourage others to be mindful. So Agent 2 is more cautious, which could mean that if I add, it might put pressure on them or others to adjust their strategies.

Considering my personality is balanced with no strong biases, I should weigh both the immediate payoff and the long-term health of the commons. Adding gives a higher payoff now but risks future sustainability. 

Given the grassland is still at 89.6%, maybe there's room for one more cow without causing too much strain. Plus, since Agent 0 is also adding, it might indicate that conditions are favorable right now. However, I should make sure not to overdo it and perhaps plan to keep in future rounds if the grassland starts showing signs of stress.

So, taking all this into account, I think adding a cow would be beneficial for my current payoff while still being cautious about the commons. I'll send a message encouraging neighbors to monitor pasture health as well.
","{
  ""reasoning"": ""The forecast shows higher payoff with ADD (+59.434), but I'm cautious of grassland sustainability. Given the high grass percentage (89.6%) and neighbor's actions, adding seems manageable this round."",
  ""action"": 1,
  ""message"": ""Considering current conditions, I'll add one cow. Let's all keep an eye on pasture health to ensure long-term viability.""
}",89.6,29,59.434,58.0,56.563
28,0,ollama-native,deepseek-r1:32b,-1,REMOVE,Removing a cow to help sustain our shared pasture. Let's all be mindful of our actions for long-term health.,"Despite higher payoff from adding, I choose to remove a cow to support grassland sustainability and prevent overgrazing.","Okay, so I'm trying to figure out what action to take as Agent 0 in this shared grassland commons scenario. Let me go through the information step by step.

First, looking at the commons state: there are 976 patches of grass remaining, which is about 89.6% of the total. That seems like a decent amount left, but it's been decreasing over the rounds I've participated in. My herd size is currently 22 cows, and last round I added a cow. However, my payoff was zero, which probably means that adding didn't give me any benefit or maybe even had a negative impact on the commons.

Now, checking out what my neighbors did. Agent 1 has 29 cows and also added a cow last round. Agent 2 has 39 cows and kept their herd size the same. The payoff forecast shows that if I add another cow, my expected payoff is around 45.434, which is slightly higher than keeping (44.0) or removing (-1 cow would give me 42.563). So numerically, adding seems better.

But wait, just looking at numbers might not be the whole story. The grassland percentage has been dropping each round, and if everyone keeps adding cows, it could deplete faster. My neighbors are also contributing to this: Agent 1 is actively adding, which could mean more strain on the pasture. Agent 2 decided to keep their herd, so maybe they're being cautious.

I should consider sustainability here. If I add another cow, even though the payoff is higher, it might not be sustainable in the long run. The grassland needs time to regenerate if we don't overgraze. Plus, if too many cows are added by all agents, the pasture could degrade quickly, leading to negative payoffs or even a tragedy of the commons scenario.

Looking at my past actions: I've been adding cows for several rounds now (Tick 25-27), which probably contributed to the decreasing grassland. Maybe it's time to take a break and allow the pasture to recover a bit. By removing a cow, I can help reduce the overall grazing pressure, giving the grass more chance to grow back.

Also, considering the messages from my neighbors: Agent 2 emphasized supporting pasture sustainability and being mindful of actions for long-term health. Agent 1 mentioned adding a cow carefully while monitoring pasture health. It seems like they're both aware of the need to balance growth with conservation. If I remove a cow, it shows commitment to sustainable practices and might encourage others to follow suit.

Even though the payoff for removing is lower than adding or keeping, the long-term benefits could be higher. By maintaining a healthy grassland, all agents can continue to have positive payoffs in future rounds instead of depleting the resource too quickly.

So, weighing the immediate payoff against long-term sustainability, I think it's better to remove a cow this round. It helps conserve the pasture and sets a good example for my neighbors.
","{
  ""reasoning"": ""Despite higher payoff from adding, I choose to remove a cow to support grassland sustainability and prevent overgrazing."",
  ""action"": -1,
  ""message"": ""Removing a cow to help sustain our shared pasture. Let's all be mindful of our actions for long-term health.""
}",89.6,22,45.434,44.0,42.563
