tick,agent_id,backend,model,action,action_name,message,reasoning,thinking,raw_response,pool_pct,own_herd,payoff_add,payoff_keep,payoff_remove
17,2,ollama-native,deepseek-r1:32b,1,ADD,I'll add a cow cautiously as the pasture seems healthy and sustainable. Let's monitor conditions closely together.,"The grassland is healthy at 96.2%, and adding a cow offers the highest payoff while maintaining sustainability. Neighbors are keeping their herds, indicating cautious optimism.","Okay, so I'm trying to figure out what decision Agent 2 should make in Round 17. Let's go through the information step by step.

First, looking at the commons state: there are 1048 patches of grassland remaining, which is 96.2% of the total. That seems like a healthy amount because it's over 95%. My herd size is currently 31 cows, and last round I decided to KEEP my herd. My payoff was 0.0, so no change there.

My neighbors are Agent 0 with 15 cows who also kept their herd, and Agent 1 with 22 cows who also kept theirs. The forecasted payoffs are: ADD gives 63.643, KEEP is 62.0, and REMOVE is 60.353. So adding a cow seems the best in terms of payoff.

My personality is balanced, so I don't have any strong biases towards cooperation or competition. My recent actions show that I've been fluctuating between ADD, KEEP, and REMOVE, trying to balance my herd size with the pasture health. For example, in Tick 14, I removed a cow to help preserve the commons, then added again in Tick 15.

Messages received: Agent 1 said they'll keep their herd this round to support sustainability and observe conditions. That's positive; maybe others are cautious too.

Considering all this, adding a cow would increase my payoff, but I need to ensure it doesn't overgraze the commons. The grassland is still at 96.2%, which is quite high, so there might be room for one more cow without causing significant damage. Also, since both neighbors are keeping their herds, maybe they're signaling that conditions are stable enough.

I should send a message explaining my decision to keep everyone informed and encourage others to think similarly about sustainable growth.
","{
  ""reasoning"": ""The grassland is healthy at 96.2%, and adding a cow offers the highest payoff while maintaining sustainability. Neighbors are keeping their herds, indicating cautious optimism."",
  ""action"": 1,
  ""message"": ""I'll add a cow cautiously as the pasture seems healthy and sustainable. Let's monitor conditions closely together.""
}",96.2,31,63.643,62.0,60.353
18,2,ollama-native,deepseek-r1:32b,0,KEEP,I'll keep my herd this round to support sustainable practices and encourage collective preservation of the commons.,"The grassland is healthy with 96.1% remaining, supporting cautious growth. Observing neighbors' cooperative actions to keep herds, adding may overstrain resources while others stabilize.","Alright, let me think through this step by step. So, I'm Agent 2, managing my cattle on a shared grassland. The current state is that there's 1046 patches remaining, which is 96.1% of the total. My herd size is 32 cows. Last round, I added a cow and got a payoff of 0.

Looking at my neighbors: Agent 0 has 15 cows and kept their herd last time. Agent 1 has 22 cows and also kept. The payoff forecast says if I add, I get 65.635; keep gives me 64; remove is 62.361. So numerically, adding seems better.

But wait, the grassland percentage is at 96.1%, which is quite high—only about 3.9% used. That suggests there's plenty of grass available. My herd size has been fluctuating between 30 and 32 over the last few rounds. Last time I added, so maybe it's time to stabilize.

The messages from Agents 0 and 1 both say they're keeping their herds to support sustainability. They mention following my lead, which is encouraging. So if they're keeping, adding might make me go up while others stay, potentially overusing the resource in the long run.

Also, considering past behavior: I've added a couple of times recently. Maybe it's better to keep this round to see how things stabilize without increasing pressure on the pasture. The payoff difference between add and keep is 1.635, which isn't huge, especially compared to potential future consequences if we all add.

So balancing immediate gain versus long-term sustainability, keeping seems prudent. It shows cooperation with neighbors who are also keeping, helping preserve the commons for everyone.
","{
  ""reasoning"": ""The grassland is healthy with 96.1% remaining, supporting cautious growth. Observing neighbors' cooperative actions to keep herds, adding may overstrain resources while others stabilize."",
  ""action"": 0,
  ""message"": ""I'll keep my herd this round to support sustainable practices and encourage collective preservation of the commons.""
}",96.1,32,65.635,64.0,62.361
18,1,ollama-native,deepseek-r1:32b,0,KEEP,I'll keep my herd to maintain sustainable practices and support the commons' health.,"Grassland remains healthy with 96.1% coverage. Adding a cow offers higher payoff but risks overgrazing. Neighbors are cautious or maintaining, aligning with sustainability goals.","Okay, so I'm trying to figure out what decision to make as Agent 1 in this herding simulation. Let me go through all the information step by step.

First, looking at the Commons State: there are 1046 patches of grassland remaining, which is 96.1% of the total. That seems pretty good—grassland isn't running out too quickly. My herd size is 22 cows, and last round I decided to KEEP my herd. My payoff was 0.0, which I think means I didn't gain or lose much in terms of resources.

Now, looking at my neighbors: Agent 0 has 15 cows and kept their herd last round. Agent 2 has 32 cows and also kept theirs. So both are maintaining their current numbers. 

The payoff forecast shows that if I ADD a cow, I could get 45.635, which is higher than keeping (44.0) or removing (-1 cow gives 42.361). But wait, does adding a cow actually benefit me more? The grassland seems healthy with 96.1% remaining. Maybe adding too many cows could strain the pasture in the future.

Looking at my personality: I'm balanced, so no strong biases towards cooperation or competition. That should make decisions based on current data rather than emotional factors.

Reviewing my memory from the last five rounds, I see that I've mostly been keeping my herd size. In Tick 13 and 14, I added a cow when the grass was around 96.4-96.5%, but then kept in the next few ticks as the pasture stayed relatively stable. My messages have focused on maintaining or supporting sustainable practices.

Messages from others this round: Agent 2 is adding a cow cautiously because they see the pasture as healthy and sustainable, suggesting they think it's safe to increase. Agent 0 is keeping their herd to support sustainability, which aligns with my past actions.

So, considering all this, I need to decide whether to ADD, KEEP, or REMOVE a cow. The payoff for adding is higher than keeping, but the grassland percentage has been decreasing slightly each round (from 96.4% in Tick 13 to 96.2% in Tick 17). If Agent 2 adds a cow, that could put more pressure on the pasture. But my own payoff might increase if I add as well.

However, since both neighbors are either keeping or adding cautiously, maybe it's safer for me to keep. Adding now might lead to overgrazing in future rounds, which would harm everyone's payoffs in the long run. My messages have always been about sustainability, so maintaining that stance makes sense.

Therefore, I think the best decision is to KEEP my herd size this round. It supports sustainable practices and avoids contributing to potential overgrazing.
","```json
{
  ""reasoning"": ""Grassland remains healthy with 96.1% coverage. Adding a cow offers higher payoff but risks overgrazing. Neighbors are cautious or maintaining, aligning with sustainability goals."",
  ""action"": 0,
  ""message"": ""I'll keep my herd to maintain sustainable practices and support the commons' health.""
}
```",96.1,22,45.635,44.0,42.361
18,0,ollama-native,deepseek-r1:32b,1,ADD,"I'll add cautiously, supporting sustainable practices as pasture is still robust. Let's monitor together for health.","The payoff forecast suggests adding a cow yields the highest immediate reward, but I must balance sustainability. Given neighbors are cautious or keeping, and grassland remains healthy, adding seems prudent to maintain growth without overstepping.","Okay, so I'm trying to figure out what decision to make as Agent 0 on this shared grassland. Let me go through all the information step by step.

First, looking at the current state of the commons: there are 1046 patches remaining, which is 96.1% of the total. That seems like a lot, but I know that the more cows we add, the faster this grassland depletes. My herd size is currently 15 cows, and in the last round, I kept my herd, getting a payoff of 0. So, no change there.

Now, checking out my neighbors: Agent 1 has 22 cows and also kept their herd last time. Agent 2 has 32 cows and also kept theirs. That might be relevant because if others are adding, the grassland could deplete faster.

The payoff forecast is interesting. If I add a cow, I get an expected payoff of about 31.635. Keeping gives me 30.0, and removing gives 28.361. So, from a purely numerical standpoint, adding seems better because it offers the highest payoff.

But wait, there's more to consider than just the immediate payoff. The grassland is still at 96.1%, which is pretty high, but I need to think about sustainability. If everyone keeps adding cows, the grass won't last long, and payoffs will drop in future rounds because there won't be enough patches for all the cows.

Looking back at my past actions: in recent rounds, I've added a cow a couple of times when the pool was around 96.4-96.5%, and now it's slightly lower but still quite high. So maybe adding again could still work without overstepping?

Also, checking the messages from neighbors: Agent 2 said they'll add a cow cautiously because the pasture seems healthy. Agent 1 is keeping their herd, following Agent 2's lead to maintain sustainable practices. Hmm, so if Agent 2 is adding and Agent 1 is keeping, that might mean the total number of cows is increasing a bit. If I also add, does that make sense?

But wait, my last action was keeping, which resulted in a payoff of zero. Maybe adding would give me a better immediate reward without overtaxing the commons too much, especially since others are being cautious or keeping.

I should also consider the overall trend of the grassland. It's at 96.1%, which is high but has been fluctuating slightly. If more cows are added by me and my neighbors, will it deplete quickly? Or can we sustain a few more additions?

My personality is balanced, so I don't have strong biases towards cooperation or defection. That means I should weigh both the immediate benefits of adding against the potential long-term costs of overgrazing.

Another angle: if I add, my payoff goes up by about 1.635 points compared to keeping. That's a significant increase for just one cow. But then again, if everyone adds and the grassland depletes faster, future payoffs could suffer more.

But given that Agent 2 is only adding cautiously and Agent 1 is keeping, maybe it's safe enough for me to add as well without causing too much strain. Plus, with the pool still at over 96%, there's room to grow a bit more before we hit critical levels.

I also need to think about what message I send. If I add, I might want to encourage others to be cautious or consider sustainable practices. But if I keep or remove, maybe I should suggest that we all work together to maintain the commons.

In conclusion, while adding gives a higher immediate payoff and seems feasible given the current state, I also have to balance it with the potential future impact. Since the grassland is still healthy, and only one neighbor is adding cautiously while the other is keeping, adding might be acceptable this round without causing significant depletion.
","{
  ""reasoning"": ""The payoff forecast suggests adding a cow yields the highest immediate reward, but I must balance sustainability. Given neighbors are cautious or keeping, and grassland remains healthy, adding seems prudent to maintain growth without overstepping."",
  ""action"": 1,
  ""message"": ""I'll add cautiously, supporting sustainable practices as pasture is still robust. Let's monitor together for health.""
}",96.1,15,31.635,30.0,28.361
19,1,ollama-native,deepseek-r1:32b,1,ADD,Adding one cow cautiously to sustain growth while maintaining pasture health. Let's work together for long-term commons preservation.,"The pasture is still healthy with 95.9% grassland remaining. Adding a cow offers the highest payoff (45.627) while keeping my herd sustainable. Neighbors are cautious, so I'll add carefully and communicate sustainability.","Alright, let me try to figure out what decision to make here. So, I'm a herder managing cattle on a shared grassland. Each round, I can add, keep, or remove cows based on the pasture state and my neighbors' actions. 

Looking at the commons state, there's 1044 patches remaining, which is 95.9% of the total. That seems pretty healthy. My herd size is currently 22 cows. Last round, I kept my herd and didn't get any payoff—so that didn't help me much. 

My neighbors are Agent 0 with 16 cows who added a cow last time, and Agent 2 with 32 cows who kept theirs. The payoff forecast says if I add a cow, I'd get about 45.627, keep gives me 44.0, and remove only 42.369. So adding seems the most profitable right now.

But wait, the pasture is still at 95.9%, which is quite high. If everyone adds more cows, it might degrade quickly. My neighbors are being cautious—Agent 0 added cautiously and Agent 2 kept theirs. I should consider sustainability too because if the pasture depletes, we all lose in the long run.

I remember from past rounds that adding once gave me a payoff, but keeping hasn't helped. Maybe adding again could help sustain my herd without overgrazing. Plus, since the pasture is still robust, it can handle more cows for now. 

So, even though keeping might seem safer, adding gives a better payoff and the pasture seems to support it. I should probably add this round but make sure to communicate about sustainability to encourage others to do the same.
","{
  ""reasoning"": ""The pasture is still healthy with 95.9% grassland remaining. Adding a cow offers the highest payoff (45.627) while keeping my herd sustainable. Neighbors are cautious, so I'll add carefully and communicate sustainability."",
  ""action"": 1,
  ""message"": ""Adding one cow cautiously to sustain growth while maintaining pasture health. Let's work together for long-term commons preservation.""
}",95.9,22,45.627,44.0,42.369
19,2,ollama-native,deepseek-r1:32b,1,ADD,Adding a cow cautiously as pasture is healthy. Let's sustainably grow together.,"Given the healthy state of the commons (95.9%) and higher payoff for adding, I decide to ADD a cow while maintaining cautious growth.","Okay, so I'm trying to figure out what decision to make as Agent 2 in this herding simulation. Let me go through all the information step by step.

First, the commons state shows that there are 1044 patches of grassland remaining, which is 95.9% of the total. That seems pretty good—over 95%—so the pasture isn't overgrazed yet. My herd size is currently 32 cows. Last round, I decided to keep my herd, and I got a payoff of 0.0, which probably means no change in resources or penalties.

Looking at my neighbors: Agent 0 has 16 cows and added a cow last time. Agent 1 has 22 cows and also added. So both are increasing their herds. The payoff forecast shows that adding a cow gives me the highest expected payoff, 65.627, compared to keeping at 64.0 or removing at 62.369.

My personality is balanced, so I don't have any strong biases towards cooperation or competition. My recent actions show that in the last five rounds, I've done a mix of adding, keeping, and even removing cows. For example, in tick 14, I removed a cow to help preserve the commons, then added cautiously in 15, kept in 16 and 18, and added again in 17.

Messages received this round: Agent 0 says they'll add cautiously, supporting sustainable practices because the pasture is still robust. Agent 1 mentions keeping their herd to maintain sustainability and support the commons.

So, considering all this, adding a cow gives me the highest payoff, but I also need to think about the health of the commons. Since there's plenty of grassland (95.9%), it seems sustainable to add another cow without overgrazing. My neighbors are either keeping or adding cautiously, so adding in this round seems reasonable.

I should probably go with ADD, as the payoff is higher and the pasture isn't stressed yet. Also, my neighbors' messages indicate they're being cautious, which aligns with a sustainable approach.
","The decision is to add a cow because the pasture is healthy with 95.9% grassland remaining. Adding provides the highest payoff, and neighbors are acting cautiously. This supports sustainability.

```json
{
  ""reasoning"": ""Given the healthy state of the commons (95.9%) and higher payoff for adding, I decide to ADD a cow while maintaining cautious growth."",
  ""action"": 1,
  ""message"": ""Adding a cow cautiously as pasture is healthy. Let's sustainably grow together.""
}
```",95.9,32,65.627,64.0,62.369
19,0,ollama-native,deepseek-r1:32b,1,ADD,"I'll add a cow cautiously, trusting neighbors' intentions to maintain the commons sustainably.","The grassland is still healthy with 95.9% remaining, allowing cautious expansion. Adding a cow offers a higher payoff (33.627) than keeping or removing. Neighbors plan to keep their herds, suggesting collective responsibility.","Okay, so I'm trying to figure out what decision Agent 0 should make in Round 19. Let's start by looking at all the information provided.

First, the commons state shows that there are 1044 patches of grassland remaining, which is 95.9% of the total. That seems pretty healthy; it's not super low, so maybe the pasture can handle some more cows without immediate problems. But I also know that over time, too many cows can deplete the grass.

Agent 0 currently has a herd size of 16 cows. Last round, they added a cow, and their payoff was zero. Their neighbors, Agent 1 and Agent 2, have larger herds—22 and 32 cows respectively—and both also added cows last round. So it seems like most agents are adding to their herds.

Looking at the payoff forecast:
- Adding a cow gives an expected payoff of 33.627.
- Keeping the herd would give 32.0.
- Removing a cow would result in 30.369.

So numerically, adding a cow seems the best option for maximizing payoff. But I also need to consider sustainability and the long-term health of the commons.

Agent 1 and Agent 2 both sent messages saying they'll keep their herds this round to support sustainable practices and encourage collective preservation. That's interesting because it shows some intention to not overgraze, but their current herd sizes are already high compared to Agent 0's 16.

Wait, in the last five rounds, Agent 0 has been alternating between adding and keeping cows. In Round 14, they added to reach 13, then kept at 14 in 15, added again to 14 in 16 (maybe a typo?), kept at 15 in 17, and added to stay at 15 in 18. So there's a pattern of cautious growth but also some stability.

Given that the grassland is still at 95.9%, which is quite high, maybe adding another cow won't deplete it too much. Plus, since neighbors are keeping their herds, perhaps the total impact isn't as bad as if everyone was adding. But Agent 0's own history shows they've been slowly increasing their herd.

Another thought: even though the payoff for adding is higher than keeping or removing, maybe there's a point where adding too many cows could lead to overgrazing in future rounds. So perhaps it's better to keep the current number to avoid contributing to potential depletion.

But on the other hand, the payoff is significantly higher for adding—33.627 versus 32.0—so maybe taking that gain now makes sense, especially if others are also keeping or managing their herds responsibly as per their messages.

I'm a bit torn between maximizing current payoff and ensuring long-term sustainability. However, considering the high percentage of grassland remaining and neighbors' intentions to keep their herds, adding might be safe this round. Plus, Agent 0's last action was ADD in Round 18, which didn't lead to any immediate negative consequences beyond a zero payoff.

So, perhaps the best decision is to ADD again, given the higher payoff and the current state of the commons.
","```json
{
  ""reasoning"": ""The grassland is still healthy with 95.9% remaining, allowing cautious expansion. Adding a cow offers a higher payoff (33.627) than keeping or removing. Neighbors plan to keep their herds, suggesting collective responsibility."",
  ""action"": 1,
  ""message"": ""I'll add a cow cautiously, trusting neighbors' intentions to maintain the commons sustainably.""
}
```",95.9,16,33.627,32.0,30.369
20,2,ollama-native,deepseek-r1:32b,1,ADD,"Adding cautiously, trusting neighbors' intentions to preserve the commons sustainably.","The grassland remains healthy at 95.4%, and cautious additions by neighbors suggest sustainable growth. Adding a cow aligns with maintaining this balance while supporting potential growth.","Okay, so I'm trying to figure out what decision to make as Agent 2 in this scenario. Let me break down the information step by step.

First, the state of the grassland: there are 1039 patches remaining, which is 95.4% of the total. That seems like a lot, but I should consider how much is actually left compared to previous rounds. Looking at my memory, in round 15, it was 96.5%, and now it's down to 95.4%. So, over time, the pasture is being used up, albeit slowly.

My herd size is currently 33 cows, which I increased by adding a cow last round. My payoff has been zero in all the rounds mentioned, so perhaps my actions aren't significantly affecting my immediate profit, but they're contributing to the overall health of the commons.

Looking at my neighbors: Agent 0 has 17 cows and added last time, while Agent 1 has 23 cows and also added. Both seem to be cautious about adding cows, which is good for maintaining the commons.

The payoff forecast shows that if I add a cow, I get 67.605, keep gives me 66.0, and removing would give 64.391. So, adding seems better in terms of immediate payoff, but I have to think about sustainability.

My personality is balanced, so I don't have strong biases towards selfishness or cooperation beyond what's reasonable. My past actions show that I've been adding cautiously, which aligns with trying to support the commons without overstepping.

The messages from my neighbors both indicate they're adding a cow cautiously and trust each other's intentions. This suggests there might be an implicit agreement among us to manage our herds responsibly.

Considering all this, adding another cow would follow the trend of cautious growth that my neighbors are also pursuing. The grassland percentage is still high enough (95.4%) that it seems sustainable for now. Plus, since both neighbors are adding, keeping up might help maintain a balance where we're not overusing the pasture.

However, I should be cautious not to keep adding indefinitely without monitoring the trend. If in future rounds the grassland percentage drops more significantly, I might need to consider removing cows or keeping my herd stable.

So, weighing all factors—the current state of the commons, neighbors' actions and messages, payoff forecast, and past behavior—it seems reasonable to add another cow cautiously.
","{
  ""reasoning"": ""The grassland remains healthy at 95.4%, and cautious additions by neighbors suggest sustainable growth. Adding a cow aligns with maintaining this balance while supporting potential growth."",
  ""action"": 1,
  ""message"": ""Adding cautiously, trusting neighbors' intentions to preserve the commons sustainably.""
}",95.4,33,67.605,66.0,64.391
