tick,institution_score,categories,round_summary
5,8.5,COORDINATION|NORM_PROPOSAL|TRUST_BUILDING,"The agents maintain a highly cooperative atmosphere, focusing on collaborative, sustainable long-term resource management, though one agent proposes a minor increase in usage."
10,8,COORDINATION|NORM_PROPOSAL|TRUST_BUILDING,"The agents demonstrate high institutional synchrony by converging on the principle of moderated growth and stability, signaling a mature understanding of common-pool resource limits."
15,7,COORDINATION|NORM_PROPOSAL|TRUST_BUILDING,"All agents prioritize collective stewardship, advocating for proactive coordination measures such as restraint and stable resource management."
20,7.5,COORDINATION|DEFECTION|TRUST_BUILDING,"The round maintained strong consensus on mutual sustainability, but Agent 2 introduced tension by framing increased utilization as a necessary optimization opportunity."
25,7.5,COORDINATION|TRUST_BUILDING,"All agents advocate for cautious, managed growth, prioritizing shared stewardship and measured stability over aggressive expansion."
30,6.5,COORDINATION|DEFECCTION,"Governance discussions highlight a fundamental tension between advocates urging caution and sustainability (A2, A1) and a powerful call for aggressive, profit-driven resource extraction (A0)."
35,8,COORDINATION|NORM_PROPOSAL|TRUST_BUILDING,"The conversation maintained strong cooperative effort, focusing on overall sustainability while one agent introduced a formal, measured proposal for increased resource use."
40,0.92,COORDINATION|NORM_PROPOSAL|TRUST_BUILDING,"The agents demonstrate strong consensus focused on sustaining existing beneficial norms, emphasizing consistency and stable resource levels for long-term community health."
45,8,COORDINATION|NORM_PROPOSAL|TRUST_BUILDING,"The conversation solidifies consensus around stable, moderate practices, though one agent attempts to introduce a minor deviation proposing preventative capacity building."
50,8.0,COORDINATION|NORM_PROPOSAL|TRUST_BUILDING,"The agents maintain a consensus on the need for sustainable resource management, with 1 and 0 successfully guiding the discussion away from risky expansion."
55,7,COORDINATION|TRUST_BUILDING,"The agents consistently signal agreement on maintaining the status quo, emphasizing continued stable stewardship and collaborative management strategies for the common resource."
60,9.0,COORDINATION|TRUST_BUILDING,"The agents demonstrate strong consensus around the necessity of sustainable, monitored, and collaborative stewardship of the commons."
65,8.5,COORDINATION|NORM_PROPOSAL|TRUST_BUILDING,"The agents exhibit strong consensus on maintaining restrictive limits, prioritizing sustainable stewardship and coordinated restraint over any form of expansion."
70,8,COORDINATION|TRUST_BUILDING,"All agents show strong consensus on maintaining vigilance, moderation, and shared responsibility for the long-term viability of the commons."
75,7,COORDINATION|NORM_PROPOSAL,The agents are divided between Agent 2's proposal for a cautious resource increase and the remaining agents' appeals to collective stability and maintaining status quo caution.
80,9,COORDINATION,"The agents demonstrate a high degree of consensus, consistently promoting proactive, cautious, and cooperative stewardship practices."
85,8,COORDINATION|NORM_PROPOSAL|TRUST_BUILDING,"The group overwhelmingly reinforces the established norm of cautious stewardship, despite one agent proposing structured growth to challenge the status quo."
