tick,institution_score,categories,round_summary
5,8,NORM_PROPOSAL,All agents proposed continued cooperation and preservation of the commons.
10,0,,
15,8,NORM_PROPOSAL,"All agents reinforced norms of maintaining stable herds and protecting the commons, emphasizing cooperation."
20,7,COORDINATION|TRUST_BUILDING,"Agents emphasized trust-building and coordination in maintaining the commons, without any signs of defection or sanctions."
25,0,,
30,9,TRUST_BUILDING,"All agents expressed appreciation and encouragement to continue maintaining a healthy commons, emphasizing trust-building."
35,9,COORDINATION,Agents emphasize ongoing cooperation and preservation of the commons.
40,5,DEFECTION|TRUST_BUILDING,Agents express gratitude for cooperation and a hopeful addition to the commons.
45,9,COORDINATION|TRUST_BUILDING,Agents are emphasizing trust-building and coordination to sustain shared resources.
